{
  "$schema": "https://paperandslate.org/schemas/eom/1.0/signature.schema.json",
  "specification": "https://paperandslate.org/spec/eom/1.0",
  "version": "1.0",
  "id": "https://ecme-high.example/eom/organization#static-signature",
  "type": "signature",
  "canonical": "https://ecme-high.example/eom/organization#signature",
  "subject": "https://ecme-high.example/eom/organization",
  "keyId": "https://ecme-high.example/eom/keys#static-vector-2027",
  "algorithm": "EdDSA",
  "canonicalization": "RFC8785-JCS",
  "payloadDigest": "sha-256=:t8NZ0ZeMDJZuqIAA41g9JPCS4BHBMB+Km3ak3+8zkWM=:",
  "protected": "eyJhbGciOiJFZERTQSIsImI2NCI6ZmFsc2UsImNyaXQiOlsiYjY0IiwiZW9tIl0sImN0eSI6ImFwcGxpY2F0aW9uL2pzb24iLCJlb20iOnsidmVyc2lvbiI6IjEuMCIsImNhbm9uaWNhbGl6YXRpb24iOiJSRkM4Nzg1LUpDUyIsImNyZWF0ZWRBdCI6IjIwMjctMDgtMDFUMDA6MDA6MDAuMDAwWiIsImV4cGlyZXMiOiIyMDMwLTA4LTAxVDAwOjAwOjAwLjAwMFoifSwia2lkIjoiaHR0cHM6Ly9lY21lLWhpZ2guZXhhbXBsZS9lb20va2V5cyNzdGF0aWMtdmVjdG9yLTIwMjcifQ",
  "signature": "YfIF-vg_noRxCgvrhTz7yAAq-RWHkJ6M2kZvlKcur5U8ctuE3fZtoa8L48MpKC1snxQRLwI3MH91bAR-ostbDg",
  "compact": "eyJhbGciOiJFZERTQSIsImI2NCI6ZmFsc2UsImNyaXQiOlsiYjY0IiwiZW9tIl0sImN0eSI6ImFwcGxpY2F0aW9uL2pzb24iLCJlb20iOnsidmVyc2lvbiI6IjEuMCIsImNhbm9uaWNhbGl6YXRpb24iOiJSRkM4Nzg1LUpDUyIsImNyZWF0ZWRBdCI6IjIwMjctMDgtMDFUMDA6MDA6MDAuMDAwWiIsImV4cGlyZXMiOiIyMDMwLTA4LTAxVDAwOjAwOjAwLjAwMFoifSwia2lkIjoiaHR0cHM6Ly9lY21lLWhpZ2guZXhhbXBsZS9lb20va2V5cyNzdGF0aWMtdmVjdG9yLTIwMjcifQ..YfIF-vg_noRxCgvrhTz7yAAq-RWHkJ6M2kZvlKcur5U8ctuE3fZtoa8L48MpKC1snxQRLwI3MH91bAR-ostbDg",
  "detached": true,
  "createdAt": "2027-08-01T00:00:00.000Z",
  "expires": "2030-08-01T00:00:00.000Z",
  "contentType": "application/json"
}
